DB|qEGVA|SC_OPCODE_DB|Returns the real depreciation of an asset for a specified period using the fixed-declining balance method.|75CYS|HID_FUNC_GDA2|Returns the depreciation of an asset for a specified period using the fixed-declining balance method.This form of depreciation is used if you want to get a higher depreciation value at the beginning of the depreciation (as opposed to linear depreciation). The depreciation value is reduced with every depreciation period by the depreciation already deducted from the initial cost.|
DDB|2NiJm|SC_OPCODE_DDB|Calculates the depreciation of an asset for a specific period using the double-declining balance method or declining balance factor.|7fgyK|HID_FUNC_GDA|Returns the depreciation of an asset for a specified period using the arithmetic-declining method.Use this form of depreciation if you require a higher initial depreciation value as opposed to linear depreciation. The depreciation value gets less with each period and is usually used for assets whose value loss is higher shortly after purchase (for example, vehicles, computers). Please note that the book value will never reach zero under this calculation type.|
SYD|XJJxD|SC_OPCODE_SYD|Calculates the arithmetically declining value of an asset (depreciation) for a specified period.|yo8u2|HID_FUNC_DIA|Returns the arithmetic-declining depreciation rate.Use this function to calculate the depreciation amount for one period of the total depreciation span of an object. Arithmetic declining depreciation reduces the depreciation amount from period to period by a fixed sum.|
PV|iDXWU|SC_OPCODE_PV|Present value. Calculates the present value of an investment.|RyAQv|HID_FUNC_BW|Returns the present value of an investment resulting from a series of regular payments.Use this function to calculate the amount of money needed to be invested at a fixed rate today, to receive a specific amount, an annuity, over a specified number of periods. You can also determine how much money is to remain after the elapse of the period. Specify as well if the amount is to be paid out at the beginning or at the end of each period.Enter these values either as numbers, expressions or references. If, for example, interest is paid annually at 8%, but you want to use month as your period, enter 8%/12 under Rate and %PRODUCTNAME Calc with automatically calculate the correct factor.|
PERMUTATIONA|MGS6C|SC_OPCODE_PERMUTATION_A|Returns the number of permutations for a given number of objects (repetition allowed).|qmDVC|HID_FUNC_VARIATIONEN2|Returns the number of permutations for a given number of objects (repetition allowed).|
PERMUT|2YtiP|SC_OPCODE_PERMUT|Returns the number of permutations for a given number of elements without repetition.|BZCuj|HID_FUNC_VARIATIONEN|Returns the number of permutations for a given number of objects.|
COMBINA|J48iK|SC_OPCODE_COMBIN_A|Calculates the number of combinations of elements including repetition.|mPP3c|HID_FUNC_KOMBINATIONEN2|Returns the number of combinations of a subset of items including repetitions.|
COMBIN|TBNEU|SC_OPCODE_COMBIN|Calculates the number of combinations for elements without repetition.|odb62|HID_FUNC_KOMBINATIONEN|Returns the number of combinations for elements without repetition.|
POISSON.DIST|MSB43|SC_OPCODE_POISSON_DIST_MS|Returns the Poisson distribution.|Wghve|HID_FUNC_POISSON_DIST_MS|Returns the Poisson distribution.|
POISSON|sRGfk|SC_OPCODE_POISSON_DIST|Returns the Poisson distribution.|pcFqE|HID_FUNC_POISSON|Returns the Poisson distribution.|
BINOM.DIST|vuyAB|SC_OPCODE_BINOM_DIST_MS|Values of the binomial distribution.|fDSB9|HID_FUNC_BINOM_DIST_MS|Returns the individual term binomial distribution probability.|
BINOMDIST|Pjcki|SC_OPCODE_BINOM_DIST|Values of the binomial distribution.|ntGe3|HID_FUNC_BINOMVERT|Returns the individual term binomial distribution probability.|
EXPON.DIST|wPEE8|SC_OPCODE_EXP_DIST_MS|Values of the exponential distribution.|scD8c|HID_FUNC_EXP_DIST_MS|Returns the exponential distribution.|
EXPONDIST|ESWiB|SC_OPCODE_EXP_DIST|Values of the exponential distribution.|CF96U|HID_FUNC_EXPONVERT|Returns the exponential distribution.|
NORM.DIST|ASgWk|SC_OPCODE_NORM_DIST_MS|Values of the normal distribution.|zAgNx|HID_FUNC_NORMDIST_MS|Returns the density function or the normal cumulative distribution.|
NORMDIST|7FGSp|SC_OPCODE_NORM_DIST|Values of the normal distribution.|WN45x|HID_FUNC_NORMVERT|Returns the density function or the normal cumulative distribution.|
B|SACzY|SC_OPCODE_B|Returns the probability of a trial result using binomial distribution.|n4Rdd|HID_FUNC_B|Returns the probability of a sample with binomial distribution.|
STDEV.S|BU3qj|SC_OPCODE_ST_DEV_S|Calculates the standard deviation based on a sample.|HHWB2|HID_FUNC_ST_DEV_S|Calculates the standard deviation based on sample of the population.|
STDEV.P|PVFaN|SC_OPCODE_ST_DEV_P_MS|Calculates the standard deviation based on the entire population.|vyErB|HID_FUNC_ST_DEV_P_MS|Calculates the standard deviation based on the entire population.|
STDEVPA|GHsGr|SC_OPCODE_ST_DEV_P_A|Returns the standard deviation based on the entire population. Text is evaluated as zero.|9yQAY|HID_FUNC_STABWNA|Calculates the standard deviation based on the entire population.|
STDEVP|5FW4x|SC_OPCODE_ST_DEV_P|Calculates the standard deviation based on the entire population.|CFM3p|HID_FUNC_STABWN|Calculates the standard deviation based on the entire population.|
STDEVA|bABCw|SC_OPCODE_ST_DEV_A|Returns the standard deviation based on a sample. Text is evaluated as zero.|gE9PG|HID_FUNC_STABWA|Calculates the standard deviation of an estimation based on a sample.|
STDEV|iAycZ|SC_OPCODE_ST_DEV|Calculates the standard deviation based on a sample.|VXv5W|HID_FUNC_STABW|Estimates the standard deviation based on a sample.|
VAR.S|4p9A5|SC_OPCODE_VAR_S|Calculates the variance based on a sample.|3qmyn|HID_FUNC_VAR_S|Estimates the variance based on a sample.|
VAR.P|e4dLQ|SC_OPCODE_VAR_P_MS|Calculates variance based on the entire population.|VAdCJ|HID_FUNC_VAR_P_MS|Calculates a variance based on the entire population.|
VARPA|HrE2s|SC_OPCODE_VAR_P_A|Returns the variance based on the entire population. Text is evaluated as zero.|RDhTQ|HID_FUNC_VARIANZENA|Calculates the variance based on the entire population. The value of text is 0.|
VARP|NRpd8|SC_OPCODE_VAR_P|Calculates variance based on the entire population.|6QDSX|HID_FUNC_VARIANZEN|Calculates a variance based on the entire population.|
VARA|6ios3|SC_OPCODE_VAR_A|Returns the variance based on a sample. Text is evaluated as zero.|B54Yr|HID_FUNC_VARIANZA|Estimates a variance based on a sample. The value of text is 0.|
VAR|HCvpt|SC_OPCODE_VAR|Calculates the variance based on a sample.|jmVEj|HID_FUNC_VARIANZ|Estimates the variance based on a sample.|
ISPMT|Wc3DB|SC_OPCODE_ISPMT|Returns the amount of interest for constant amortization rates.|EJUDM|HID_FUNC_ISPMT|Calculates the level of interest for unchanged amortization installments.|
MIRR|AEjoW|SC_OPCODE_MIRR|Returns the modified internal rate of return for a series of investments.|mkDkF|HID_FUNC_QIKV|Calculates the modified internal rate of return of a series of investments.|
IRR|hwCoX|SC_OPCODE_IRR|Returns the actuarial rate of interest of an investment excluding costs or profits.|49dji|HID_FUNC_IKV|Calculates the internal rate of return for an investment. The values represent cash flow values at regular intervals, at least one value must be negative (payments), and at least one value must be positive (income).|
NPV|6wRqA|SC_OPCODE_NPV|Net present value. Calculates the net present value of an investment based on a series of periodic payments and a discount rate.|2aUFC|HID_FUNC_NBW|Returns the present value of an investment based on a series of periodic cash flows and a discount rate. To get the net present value, subtract the cost of the project (the initial cash flow at time zero) from the returned value.|
COUNTA|rCC8N|SC_OPCODE_COUNT_2|Counts how many values are in the list of arguments.|HXCpE|HID_FUNC_ANZAHL2|Counts how many values are in the list of arguments. Text entries are also counted, even when they contain an empty string of length 0. If an argument is an array or reference, empty cells within the array or reference are ignored.UFI: fix to #i35888#|
COUNT|gnDKM|SC_OPCODE_COUNT|Counts how many numbers are in the list of arguments.|Aqs5H|HID_FUNC_ANZAHL|Counts how many numbers are in the list of arguments. Text entries are ignored.|
AVERAGEA|sLQ9c|SC_OPCODE_AVERAGE_A|Returns the average value for a sample. Text is evaluated as zero.|TzEY7|HID_FUNC_MITTELWERTA|Returns the average of the arguments. The value of a text is 0.|
AVERAGE|SGaxB|SC_OPCODE_AVERAGE|Returns the average of a sample.|ACAWo|HID_FUNC_MITTELWERT|Returns the average of the arguments.|
PRODUCT|hbjVH|SC_OPCODE_PRODUCT|Multiplies the arguments.|CgRzr|HID_FUNC_PRODUKT|Multiplies all the numbers given as arguments and returns the product.|
SUM|z3v8h|SC_OPCODE_SUM|Returns the sum of all arguments.|YEi5V|HID_FUNC_SUMME|Adds all the numbers in a range of cells.|
MAXA|7FDpy|SC_OPCODE_MAX_A|Returns the maximum value in a list of arguments. Text is evaluated as Zero.|tdkda|HID_FUNC_MAXA|Returns the maximum value in a list of arguments. In opposite to MAX, here you can enter text. The value of the text is 0.The functions MINA() and MAXA() return 0 if no value (numeric or text) and no error was encountered.|
MAX|4KMoz|SC_OPCODE_MAX|Returns the maximum value in a list of arguments.|4LCmn|HID_FUNC_MAX|Returns the maximum value in a list of arguments.Returns 0 if no numeric value and no error was encountered in the cell range(s) passed as cell reference(s). Text cells are ignored by MIN() and MAX(). The functions MINA() and MAXA() return 0 if no value (numeric or text) and no error was encountered. Passing a literal string argument to MIN() or MAX(), e.g. MIN("string"), still results in an error.|
MINA|r4Mtc|SC_OPCODE_MIN_A|Returns the smallest value in a list of arguments. Text is evaluated as zero.|PjkQk|HID_FUNC_MINA|Returns the minimum value in a list of arguments. Here you can also enter text. The value of the text is 0.The functions MINA() and MAXA() return 0 if no value (numeric or text) and no error was encountered.|
MIN|A8sBe|SC_OPCODE_MIN|Returns the minimum value in a list of arguments.|qc9kx|HID_FUNC_MIN|Returns the minimum value in a list of arguments.Returns 0 if no numeric value and no error was encountered in the cell range(s) passed as cell reference(s). Text cells are ignored by MIN() and MAX(). The functions MINA() and MAXA() return 0 if no value (numeric or text) and no error was encountered. Passing a literal string argument to MIN() or MAX(), e.g. MIN("string"), still results in an error.|
DATEDIF|U5n64|SC_OPCODE_GET_DATEDIF|Returns the number of whole days, months or years between 'start date' and 'end date'.|DPFXB|HID_FUNC_DATEDIF||
DAYS360|YwiBE|SC_OPCODE_GET_DIFF_DATE_360|Calculates the number of days between two dates based on a 360-day year.|kAGux|HID_FUNC_TAGE360|Returns the difference between two dates based on the 360 day year used in interest calculations.|
DAYS|hhwRD|SC_OPCODE_GET_DIFF_DATE|Calculates the number of days between two dates.|XukFr|HID_FUNC_TAGE|Calculates the difference between two date values. The result returns the number of days between the two days.|
TIME|SdChB|SC_OPCODE_GET_TIME|Determines a time value from the details for hour, minute and second.|6GiJx|HID_FUNC_ZEIT|TIME returns the current time value from values for hours, minutes and seconds. This function can be used to convert a time based on these three elements to a decimal time value.|
DATE|DGufs|SC_OPCODE_GET_DATE|Provides an internal number for the date given.|qsXz8|HID_FUNC_DATUM|This function returns the number of whole days, months or years between Start date and End date.|
SUMXMY2|rTo2W|SC_OPCODE_SUM_XMY2|Returns the sum of squares of differences of two arrays.|qp53A|HID_FUNC_SUMMEXMY2|Adds the squares of the variance between corresponding values in two arrays.|
SUMX2PY2|GZ3Xb|SC_OPCODE_SUM_X2DY2|Returns the total of the square sum of two arrays.|F2zCT|HID_FUNC_SUMMEX2PY2|Returns the sum of the sum of squares of corresponding values in two arrays.|
SUMX2MY2|9EAHv|SC_OPCODE_SUM_X2MY2|Returns the sum of the difference of squares of two arrays.|wwmB3|HID_FUNC_SUMMEX2MY2|Returns the sum of the difference of squares of corresponding values in two arrays.|
SUMSQ|9VBjs|SC_OPCODE_SUM_SQ|Returns the sum of the squares of the arguments.|KiAsa|HID_FUNC_QUADRATESUMME|If you want to calculate the sum of the squares of numbers (totaling up of the squares of the arguments), enter these into the text fields.|
SUMPRODUCT|8vgZ6|SC_OPCODE_SUM_PRODUCT|(Inner products) Returns the sum of the products of array arguments.|3D7PY|HID_FUNC_SUMMENPRODUKT|Multiplies corresponding elements in the given arrays, and returns the sum of those products.|
MOD|UqrDX|SC_OPCODE_MOD|Calculates the remainder of a division.|Q3w6r|HID_FUNC_REST|Returns the remainder when one integer is divided by another.|
LCM|yEFDv|SC_OPCODE_LCM|Lowest common multiple|BvcLj|HID_FUNC_KGV|Returns the least common multiple of one or more integers.|
GCD|xpVGW|SC_OPCODE_GCD|Greatest Common Divisor|RDCaG|HID_FUNC_GGT|Returns the greatest common divisor of two or more integers.The greatest common divisor is the positive largest integer which will divide, without remainder, each of the given integers.|
POWER|gjfAD|SC_OPCODE_POWER|Returns a^b, base a raised to the power of exponent b.|Er28a|HID_FUNC_POTENZ|Returns a number raised to another number.|
LOG|4W5tE|SC_OPCODE_LOG|Calculates the logarithm to any specified base.|8nCiV|HID_FUNC_LOG|Returns the logarithm of a number to the specified base.|
TRUNC|Uhcfm|SC_OPCODE_TRUNC|Truncates the decimal places of a number.|LnDPt|HID_FUNC_KUERZEN|Truncates a number by removing decimal places.|
ROUNDDOWN|xJL6s|SC_OPCODE_ROUND_DOWN|Rounds a number down to a predefined accuracy.|LGhzJ|HID_FUNC_ABRUNDEN|Rounds a number down, toward zero, to a certain precision.|
ROUNDUP|WLbXP|SC_OPCODE_ROUND_UP|Rounds a number up to the predefined accuracy.|q7MQx|HID_FUNC_AUFRUNDEN|Rounds a number up, away from zero, to a certain precision.|
ROUND|CY3TR|SC_OPCODE_ROUND|Rounds a number to a predefined accuracy.|wNcCu|HID_FUNC_RUNDEN|Rounds a number to a certain number of decimal places.|
FLOOR.PRECISE|nhi9Y|SC_OPCODE_FLOOR_PRECISE|Rounds number down (towards -) to the nearest multiple of significance.|6hRjb|HID_FUNC_FLOOR_PRECISE||
FLOOR.MATH|gmD4Q|SC_OPCODE_FLOOR_MATH|Rounds number down to the nearest multiple of significance, regardless of sign of significance.|BAQbD|HID_FUNC_FLOOR_MATH||
FLOOR.XCL|ur29F|SC_OPCODE_FLOOR_MS|Rounds number towards zero to the nearest multiple of absolute value of significance.|Wq2vB|HID_FUNC_FLOOR_MS|Rounds a number down to the nearest multiple of Significance, regardless of sign of Significance|
FLOOR|ycZvf|SC_OPCODE_FLOOR|Rounds number down to the nearest multiple of significance.|Cd6yK|HID_FUNC_UNTERGRENZE|Rounds a number down to the nearest multiple of Significance.|
ISO.CEILING|pNr7X|SC_OPCODE_CEIL_ISO|Rounds a number up to the nearest multiple of significance, regardless of sign of significance.|c62ev|HID_FUNC_CEIL_ISO|Rounds a number up to the nearest multiple of Significance, regardless of sign of Significance|
CEILING.PRECISE|EWtPT|SC_OPCODE_CEIL_PRECISE|Rounds a number up to the nearest multiple of significance, regardless of sign of significance.|8s4JR|HID_FUNC_CEIL_PRECISE||
CEILING.XCL|6sYhp|SC_OPCODE_CEIL_MS|Rounds a number up to the nearest multiple of significance.|ay4wy|HID_FUNC_CEIL_MS|Rounds a number up to the nearest multiple of Significance, regardless of sign of Significance|
CEILING|dVRCa|SC_OPCODE_CEIL|Rounds a number up to the nearest multiple of significance.|7ydFr|HID_FUNC_OBERGRENZE|Rounds a number up to the nearest multiple of Significance.|
CEILING.MATH|njCpy|SC_OPCODE_CEIL_MATH|Rounds a number up to the nearest multiple of significance.|oyegx|HID_FUNC_CEIL_MATH||
ATAN2|WJmDE|SC_OPCODE_ARC_TAN_2|Returns the arctangent for the specified coordinates.|iAvZt|HID_FUNC_ARCTAN2|Returns the inverse trigonometric tangent of the specified x and y coordinates.|
ARABIC|7NjFV|SC_OPCODE_ARABIC|Calculates the value of a Roman numeral.|wBFV5|HID_FUNC_ARABISCH|Calculates the value of a Roman number. The value range must be between 0 and 3999.|
FORMULA|EEoqA|SC_OPCODE_FORMULA|Returns the formula of a formula cell.|yoMKF|HID_FUNC_FORMEL|Displays the formula of a formula cell as a text string.|
ERROR.TYPE|HeuD3|SC_OPCODE_ERROR_TYPE_ODF|Returns a number corresponding to one of the error values or #N/A if no error exists|e5jFF|HID_FUNC_ERROR_TYPE_ODF||
ERRORTYPE|yXFM2|SC_OPCODE_ERROR_TYPE|Returns a number corresponding to an error type|HPTun|HID_FUNC_FEHLERTYP|Returns the number corresponding to an error value occurring in a different cell. With the aid of this number, you can generate an error message text.The Status Bar displays the predefined error code from %PRODUCTNAME if you click the cell containing the error.|
GAMMALN.PRECISE|BFK3d|SC_OPCODE_GAMMA_LN_MS|Returns the natural logarithm of the gamma function.|V4A8G|HID_FUNC_GAMMALN_MS|Returns the natural logarithm of the Gamma function: G(x).|
GAMMALN|47Wom|SC_OPCODE_GAMMA_LN|Returns the natural logarithm of the gamma function.|VzGA5|HID_FUNC_GAMMALN|Returns the natural logarithm of the Gamma function: G(x).|
NORM.S.INV|iRZfe|SC_OPCODE_S_NORM_INV_MS|Values of the inverse standard normal distribution.|atGEy|HID_FUNC_STD_NORMINV_MS|Returns the inverse of the standard normal cumulative distribution.|
NORMSINV|7UzHs|SC_OPCODE_S_NORM_INV|Values of the inverse standard normal distribution.|4GrmW|HID_FUNC_STANDNORMINV|Returns the inverse of the standard normal cumulative distribution.|
FISHERINV|kAD5g|SC_OPCODE_FISHER_INV|Returns the inverse of the Fisher transformation.|9FitE|HID_FUNC_FISHERINV|Returns the inverse of the Fisher transformation for x and creates a function close to a normal distribution.|
FISHER|CFRXx|SC_OPCODE_FISHER|Returns the Fisher transformation.|KyKqX|HID_FUNC_FISHER|Returns the Fisher transformation for x and creates a function close to a normal distribution.|
NORM.S.DIST|WBCAe|SC_OPCODE_STD_NORM_DIST_MS|The values of the standard normal distribution.|wKBLh|HID_FUNC_STD_NORMDIST_MS|Returns the standard normal cumulative distribution function. The distribution has a mean of zero and a standard deviation of one.|
NORMSDIST|7UCkN|SC_OPCODE_STD_NORM_DIST|The values of the standard normal cumulative distribution.|Evrir|HID_FUNC_STANDNORMVERT|Returns the standard normal cumulative distribution function. The distribution has a mean of zero and a standard deviation of one.It is GAUSS(x)=NORMSDIST(x)-0.5|
ODD|v7KpB|SC_OPCODE_ODD|Rounds a positive number up and negative number down to the nearest odd integer.|5PBxi|HID_FUNC_UNGERADE|Rounds a positive number up to the nearest odd integer and a negative number down to the nearest odd integer.|
EVEN|nUDpu|SC_OPCODE_EVEN|Rounds a positive number up and negative number down to the nearest even integer.|3xVxu|HID_FUNC_GERADE|Rounds a positive number up to the next even integer and a negative number down to the next even integer.|
LOG10|Wk9UM|SC_OPCODE_LOG10|Calculates the base-10 logarithm of a number.|aUufD|HID_FUNC_LOG10|Returns the base-10 logarithm of a number.|
UNICHAR|K4Hp6|SC_OPCODE_UNICHAR|Converts a code number into a Unicode character or letter.|ASKRi|HID_FUNC_UNICHAR||
UNICODE|exveD|SC_OPCODE_UNICODE|Returns the numeric code for the first Unicode character in a text string.|E6uXf|HID_FUNC_UNICODE||
ASC|Dkdzq|SC_OPCODE_ASC|Converts full-width ASCII and katakana characters to half-width.|SS5st|HID_FUNC_ASC||
JIS|MTzce|SC_OPCODE_JIS|Converts half-width ASCII and katakana characters to full-width.|dUEns|HID_FUNC_JIS||
CHAR|pDGCA|SC_OPCODE_CHAR|Converts a code number into a character or letter.|quG7s|HID_FUNC_ZEICHEN|Converts a number into a character according to the current code table. The number can be a two-digit or three-digit integer number.|
CLEAN|Jct8K|SC_OPCODE_CLEAN|Removes all nonprintable characters from text.|hXFnv|HID_FUNC_SAEUBERN|All non-printing characters are removed from the string.|
VALUE|4X6Ex|SC_OPCODE_VALUE|Converts text to a number.|UvTCu|HID_FUNC_WERT|Converts a text string into a number.|
T|w8Lza|SC_OPCODE_T|Returns a value if it is text, otherwise an empty string.|EAnZ8|HID_FUNC_T|This function returns the target text, or a blank text string if the target is not text.|
LEN|VbpJi|SC_OPCODE_LEN|Calculates length of a text string.|WAQVo|HID_FUNC_LAENGE|Returns the length of a string including spaces.|
LOWER|MFEFq|SC_OPCODE_LOWER|Converts text to lowercase.|2ozNP|HID_FUNC_KLEIN|Converts all uppercase letters in a text string to lowercase.|
PROPER|oE8Fv|SC_OPCODE_PROPER|Capitalizes the first letter in all words.|GbgGk|HID_FUNC_GROSS2|Capitalizes the first letter in all words of a text string.|
UPPER|p6ktK|SC_OPCODE_UPPER|Converts text to uppercase.|YqWcu|HID_FUNC_GROSS|Converts the string specified in the text field to uppercase.|
TRIM|99CbY|SC_OPCODE_TRIM|Removes extra spaces from text.|PYeYD|HID_FUNC_GLAETTEN|Removes spaces from a string, leaving only a single space character between words.|
CODE|jhVGi|SC_OPCODE_CODE|Returns a numeric code for the first character in a text string.|yH8rL|HID_FUNC_CODE|Returns a numeric code for the first character in a text string.|
TIMEVALUE|JBEzi|SC_OPCODE_GET_TIME_VALUE|Returns a sequential number for a text shown in a possible time entry format.|Y7zoc|HID_FUNC_ZEITWERT|TIMEVALUE returns the internal time number from a text enclosed by quotes and which may show a possible time entry format.The internal number indicated as a decimal is the result of the date system used under $[officename] to calculate date entries.If the text string also includes a year, month, or day, TIMEVALUE only returns the fractional part of the conversion.|
DATEVALUE|GVhAE|SC_OPCODE_GET_DATE_VALUE|Returns an internal number for a text having a possible date format.|m4sFj|HID_FUNC_DATWERT|Returns the internal date number for text in quotes.The internal date number is returned as a number. The number is determined by the date system that is used by $[officename] to calculate dates.If the text string also includes a time value, DATEVALUE only returns the integer part of the conversion.|
N|5oZ7J|SC_OPCODE_N|Converts a value to a number.|CAdYx|HID_FUNC_N|Returns the numeric value of the given parameter. Returns 0 if parameter is text or FALSE.If an error occurs the function returns the error value.|
ISODD|JeDEv|SC_OPCODE_IS_ODD|Returns TRUE if value is an odd integer.|iZpWD|HID_FUNC_ISTUNGERADE|Returns TRUE if the value is odd, or FALSE if the number is even.|
ISEVEN|Ar3BU|SC_OPCODE_IS_EVEN|Returns TRUE if value is an even integer.|LUFep|HID_FUNC_ISTGERADE|Returns TRUE if the value is an even integer, or FALSE if the value is odd.|
ISERROR|oBaLE|SC_OPCODE_IS_ERROR|Returns TRUE if the value is an error value.|7ANAd|HID_FUNC_ISTFEHLER|Tests for error conditions, including the #N/A error value, and returns TRUE or FALSE.|
ISERR|aqLQv|SC_OPCODE_IS_ERR|Returns TRUE if the value is an error value not equal to #N/A.|wuFYe|HID_FUNC_ISTFEHL|Tests for error conditions, except the #N/A error value, and returns TRUE or FALSE.|
ISNA|KE9aD|SC_OPCODE_IS_NV|Returns TRUE if value equals #N/A.|ho9E8|HID_FUNC_ISTNV|Returns TRUE if a cell contains the #N/A (value not available) error value.If an error occurs, the function returns FALSE.|
ISFORMULA|mkExD|SC_OPCODE_IS_FORMULA|Returns TRUE if the cell is a formula cell.|CSGLS|HID_FUNC_ISTFORMEL|Returns TRUE if a cell is a formula cell.|
ISNUMBER|7UAED|SC_OPCODE_IS_VALUE|Returns TRUE if value is a number.|CxKA5|HID_FUNC_ISTZAHL|Returns TRUE if the value refers to a number.|
ISREF|u2cHy|SC_OPCODE_IS_REF|Returns TRUE if value is a reference.|Tm96B|HID_FUNC_ISTBEZUG|Tests if the argument is a reference. Returns TRUE if the argument is a reference, returns FALSE otherwise. When given a reference this function does not examine the value being referenced.i82565|
CELL|GCcod|SC_OPCODE_CELL|Determines information about address, formatting or contents of a cell.|7968z|HID_FUNC_ZELLE|Returns information on address, formatting or contents of a cell.|
TYPE|9oYWD|SC_OPCODE_TYPE|Defines the data type of a value.|5mXzG|HID_FUNC_TYP|Returns the type of value.|
ISLOGICAL|58WAk|SC_OPCODE_IS_LOGICAL|Returns TRUE if the value carries a logical number format.|CGCT4|HID_FUNC_ISTLOG|Tests for a logical value (TRUE or FALSE).If an error occurs, the function returns FALSE.|
ISNONTEXT|D2qcE|SC_OPCODE_IS_NON_STRING|Returns TRUE if the value is not text.|fVpVN|HID_FUNC_ISTKTEXT|Tests if the cell contents are text or numbers, and returns FALSE if the contents are text.If an error occurs, the function returns TRUE.|
ISTEXT|hLDhs|SC_OPCODE_IS_STRING|Returns TRUE if value is text.|uPGoY|HID_FUNC_ISTTEXT|Returns TRUE if the cell contents refer to text.If an error occurs, the function returns FALSE.|
ISBLANK|pvqAh|SC_OPCODE_IS_EMPTY|Returns TRUE if value refers to an empty cell.|ktJFT|HID_FUNC_ISTLEER|Returns TRUE if the reference to a cell is blank. This function is used to determine if the content of a cell is empty. A cell with a formula inside is not empty. |
GAUSS|MtbiB|SC_OPCODE_GAUSS|Returns the integral values of the standard normal cumulative distribution.|6ucMp|HID_FUNC_GAUSS|Returns the standard normal cumulative distribution.It is GAUSS(x)=NORMSDIST(x)-0.5|
PHI|tGkmF|SC_OPCODE_PHI|Values of the distribution function for a standard normal distribution.|onN3z|HID_FUNC_PHI|Returns the values of the distribution function for a standard normal distribution.|
INT|DXYe4|SC_OPCODE_INT|Rounds a number down to the nearest integer.|bSPVD|HID_FUNC_GANZZAHL|Rounds a number down to the nearest integer.|
ABS|uETgj|SC_OPCODE_ABS|Absolute value of a number.|BKTRA|HID_FUNC_ABS|Returns the absolute value of a number.|
