SIGN|CFEFE|SC_OPCODE_PLUS_MINUS|Returns the algebraic sign of a number.|zunhV|HID_FUNC_VORZEICHEN|Returns the sign of a number. Returns 1 if the number is positive, -1 if negative and 0 if zero.|
SECOND|GbCuP|SC_OPCODE_GET_SEC|Determines the sequential number of the second of a minute (0-59) for the time value.|4i3C8|HID_FUNC_SEKUNDE|Returns the second for the given time value. The second is given as an integer between 0 and 59.|
MINUTE|LugxT|SC_OPCODE_GET_MIN|Determines the sequential number for the minute of the hour (0-59) for the time value.|6p5KS|HID_FUNC_MINUTE|Calculates the minute for an internal time value. The minute is returned as a number between 0 and 59.|
HOUR|PebmG|SC_OPCODE_GET_HOUR|Determines the sequential number of the hour of the day (0-23) for the time value.|kDrEv|HID_FUNC_STUNDE|Returns the hour for a given time value. The hour is returned as an integer between 0 and 23.|
DAY|FRbna|SC_OPCODE_GET_DAY|Returns the sequential date of the month as an integer (1-31) in relation to the date value.|RNiJ8|HID_FUNC_TAG|Returns the day of given date value. The day is returned as an integer between 1 and 31. You can also enter a negative date/time value.|
MONTH|nFtDb|SC_OPCODE_GET_MONTH|Determines the sequential number of a month of the year (1-12) for the date value.|ZFtrg|HID_FUNC_MONAT|Returns the month for the given date value. The month is returned as an integer between 1 and 12.|
YEAR|MmbCB|SC_OPCODE_GET_YEAR|Returns the year of a date value as an integer.|fBL9C|HID_FUNC_JAHR|Returns the year as a number according to the internal calculation rules.|
FACT|63eDf|SC_OPCODE_FACT|Calculates the factorial of a number.|odv6Q|HID_FUNC_FAKULTAET|Returns the factorial of a number.|
SQRT|z9uq5|SC_OPCODE_SQRT|Returns the square root of a number.|TKSrD|HID_FUNC_WURZEL|Returns the positive square root of a number.|
LN|nVBzP|SC_OPCODE_LN|Calculates the natural logarithm of a number.|ZkEAK|HID_FUNC_LN|Returns the natural logarithm based on the constant e of a number. The constant e has a value of approximately 2.71828182845904.|
EXP|oBARu|SC_OPCODE_EXP|Calculates the exponent for basis e.|kC3EP|HID_FUNC_EXP|Returns e raised to the power of a number. The constant e has a value of approximately 2.71828182845904.|
SECH|Rw5oL|SC_OPCODE_SECANT_HYP|Return the hyperbolic secant of a hyperbolic angle. SECH(x)=1/COSH(x)|QTvfd|HID_FUNC_SECANTHYP|Returns the hyperbolic secant of a number.|
CSCH|HYzDE|SC_OPCODE_COSECANT_HYP|Return the hyperbolic cosecant of a hyperbolic angle. CSCH(x)=1/SINH(x)|CcKu4|HID_FUNC_COSECANTHYP|Returns the hyperbolic cosecant of a number.|
SEC|ngmPB|SC_OPCODE_SECANT|Return the secant of an angle. SEC(x)=1/COS(x)|9FN7X|HID_FUNC_SECANT|Returns the secant of the given angle (in radians). The secant of an angle is equivalent to 1 divided by the cosine of that angle|
CSC|CE3d6|SC_OPCODE_COSECANT|Return the cosecant of an angle. CSC(x)=1/SIN(x)|MhXZG|HID_FUNC_COSECANT|Returns the cosecant of the given angle (in radians). The cosecant of an angle is equivalent to 1 divided by the sine of that angle|
ACOTH|mE2Fx|SC_OPCODE_ARC_COT_HYP|Returns the inverse hyperbolic cotangent of a number.|tDEYM|HID_FUNC_ARCOTHYP|Returns the inverse hyperbolic cotangent of the given number.|
ATANH|N89xF|SC_OPCODE_ARC_TAN_HYP|Returns the inverse hyperbolic tangent of a number.|VwxcD|HID_FUNC_ARTANHYP|Returns the inverse hyperbolic tangent of a number.|
ACOSH|TH8Se|SC_OPCODE_ARC_COS_HYP|Returns the inverse hyperbolic cosine of a number.|bbYEb|HID_FUNC_ARCOSHYP|Returns the inverse hyperbolic cosine of a number.|
ASINH|8EcST|SC_OPCODE_ARC_SIN_HYP|Returns the inverse hyperbolic sine of a number.|gp9Hy|HID_FUNC_ARSINHYP|Returns the inverse hyperbolic sine of a number.|
COTH|kyGMR|SC_OPCODE_COT_HYP|Returns the hyperbolic cotangent of a number.|Tuj5q|HID_FUNC_COTHYP|Returns the hyperbolic cotangent of a given number (angle).|
TANH|TMUhN|SC_OPCODE_TAN_HYP|Returns the hyperbolic tangent of a number.|E2SFh|HID_FUNC_TANHYP|Returns the hyperbolic tangent of a number.|
COSH|GJRdd|SC_OPCODE_COS_HYP|Returns the hyperbolic cosine of a number.|bw73s|HID_FUNC_COSHYP|Returns the hyperbolic cosine of a number.|
SINH|WmLQN|SC_OPCODE_SIN_HYP|Returns the hyperbolic sine of a number.|M3F5C|HID_FUNC_SINHYP|Returns the hyperbolic sine of a number.|
ACOT|zY4DB|SC_OPCODE_ARC_COT|Returns the inverse cotangent of a number.|S7HCA|HID_FUNC_ARCCOT|Returns the inverse cotangent (the arccotangent) of the given number.|
ATAN|kwCpZ|SC_OPCODE_ARC_TAN|Returns the arctangent of a number.|ScWjt|HID_FUNC_ARCTAN|Returns the inverse trigonometric tangent of a number.|
ACOS|SYMW7|SC_OPCODE_ARC_COS|Returns the arccosine of a number.|xJHpC|HID_FUNC_ARCCOS|Returns the inverse trigonometric cosine of a number.|
ASIN|Kfoej|SC_OPCODE_ARC_SIN|Returns the arcsine of a number.|AHZyT|HID_FUNC_ARCSIN|Returns the inverse trigonometric sine of a number.|
COT|LbQTN|SC_OPCODE_COT|Returns the cotangent of a number.|Vg6M3|HID_FUNC_COT|Returns the cotangent of the given angle (in radians).|
TAN|hnuwv|SC_OPCODE_TAN|Returns the tangent of a number.|i3kZt|HID_FUNC_TAN|Returns the tangent of the given angle (in radians).|
COS|SkGGz|SC_OPCODE_COS|Returns the cosine of a number.|9yjFZ|HID_FUNC_COS|Returns the cosine of the given angle (in radians).|
SIN|a63gy|SC_OPCODE_SIN|Returns the sine of a number.|zzPF6|HID_FUNC_SIN|Returns the sine of the given angle (in radians).|
RADIANS|YhMXw|SC_OPCODE_RAD|Converts degrees to radians|cLhVs|HID_FUNC_RAD|Converts degrees to radians.|
DEGREES|yCbKX|SC_OPCODE_DEG|Converts a radian to degrees|uUqNJ|HID_FUNC_DEG|Converts radians into degrees.|
CURRENT|Ksu9B|SC_OPCODE_CURRENT|Calculates the current value of the formula at the present location. |CQG9E|HID_FUNC_AKTUELL|This function returns the result to date of evaluating the formula of which it is a part (in other words the result as far as that evaluation has got). Its main use is together with the STYLE() function to apply selected styles to a cell depending on the cell contents.|
NA|JNAxh|SC_OPCODE_NO_VALUE|Not available. Returns the error value #N/A.|sLFGW|HID_FUNC_NV|Returns the error value #N/A.|
NOW|Trn4m|SC_OPCODE_GET_ACT_TIME|Determines the current time of the computer.|jPR2m|HID_FUNC_JETZT|Returns the computer system date and time. The value is updated when you recalculate the document or each time a cell value is modified.|
TODAY|BMTTR|SC_OPCODE_GET_ACT_DATE|Determines the current date of the computer.|ETD4G|HID_FUNC_HEUTE|Returns the current computer system date. The value is updated when you reopen the document or modify the values of the document.|
FALSE|5S9cg|SC_OPCODE_FALSE|Defines the logical value as FALSE.|qTShX|HID_FUNC_FALSCH|Returns the logical value FALSE. The FALSE() function does not require any arguments, and always returns the logical value FALSE.|
TRUE|ysdGP|SC_OPCODE_TRUE|Returns the logical value TRUE.|hzpBX|HID_FUNC_WAHR|The logical value is set to TRUE. The TRUE() function does not require any arguments, and always returns the logical value TRUE.|
RAND|wxSV9|SC_OPCODE_RANDOM|Returns a random number between 0 and 1.|ujsfF|HID_FUNC_ZUFALLSZAHL|Returns a random number between 0 and 1.The value of 0 can be returned, the value of 1 not.this is really true after issue 53642 will be fixed|
PI|6CPJv|SC_OPCODE_PI|Returns the value of the number Pi.|kRL3K|HID_FUNC_PI|Returns 3.14159265358979, the value of the mathematical constant PI to 14 decimal places.|
NOT|8V8Nc|SC_OPCODE_NOT|Reverses the value of the argument.|rPDCN|HID_FUNC_NICHT|Complements (inverts) a logical value.|
XOR|dbDzF|SC_OPCODE_XOR|Returns TRUE if an odd number of arguments evaluates to TRUE.|9QUTZ|HID_FUNC_XOR|Returns true if an odd number of arguments evaluates to TRUE.The arguments are either logical expressions themselves (TRUE, 1&lt;5, 2+3=7, B8&lt;10) that return logical values, or arrays (A1:C3) containing logical values.|
OR|QE2MV|SC_OPCODE_OR|Returns TRUE if an argument is TRUE.|ovDuk|HID_FUNC_ODER|Returns TRUE if at least one argument is TRUE. This function returns the value FALSE, if all the arguments have the logical value FALSE.The arguments are either logical expressions themselves (TRUE, 1&lt;5, 2+3=7, B8&lt;10) that return logical values, or arrays (A1:C3) containing logical values.|
AND|7QEfB|SC_OPCODE_AND|Returns TRUE if all arguments are TRUE.|dYoGs|HID_FUNC_UND|Returns TRUE if all arguments are TRUE. If one of the elements is FALSE, this function returns the FALSE value.The arguments are either logical expressions themselves (TRUE, 1&lt;5, 2+3=7, B8&lt;10) that return logical values, or arrays (A1:C3) containing logical values.|
CHOOSE|Bcjdw|SC_OPCODE_CHOOSE|Selects a value from a list of up to 30 value arguments.|6Qg6x|HID_FUNC_WAHL|Uses an index to return a value from a list of up to 30 values.|
IFNA|dRpWD|SC_OPCODE_IF_NA|Returns value if not a #N/A error, else alternative.|Fxkga|HID_FUNC_IFNA|Returns the value if the cell does not contains the #N/A (value not available) error value, or the alternative value if it does.|
IFERROR|8cpho|SC_OPCODE_IF_ERROR|Returns value if not an error value, else alternative.|kmGEE|HID_FUNC_IFERROR|Returns the value if the cell does not contains an error value, or the alternative value if it does.|
IF|RHSqm|SC_OPCODE_IF|Specifies a logical test to be performed.|QAFnh|HID_FUNC_WENN|Specifies a logical test to be performed.|
ROT13|QCbCd|DATE_FUNCNAME_Rot13|Encrypts or decrypts a text using the ROT13 algorithm|4wRUM|DATE_FUNCDESC_Rot13||
WEEKSINYEAR|5Te2e|DATE_FUNCNAME_WeeksInYear|Returns the number of weeks of the year in which the date entered occurs|3XCdG|DATE_FUNCDESC_WeeksInYear||
DAYSINYEAR|vE7vk|DATE_FUNCNAME_DaysInYear|Returns the number of days of the year in which the date entered occurs.|KCA2C|DATE_FUNCDESC_DaysInYear||
DAYSINMONTH|EpbA3|DATE_FUNCNAME_DaysInMonth|Returns the number of days of the month in which the date entered occurs|KQLCb|DATE_FUNCDESC_DaysInMonth||
ISLEAPYEAR|Qwaut|DATE_FUNCNAME_IsLeapYear|Returns 1 (TRUE) if the date is a day of a leap year, otherwise 0 (FALSE).|kt3PZ|DATE_FUNCDESC_IsLeapYear||
YEARS|BLYYA|DATE_FUNCNAME_DiffYears|Calculates the number of years in a specific period.|ni77P|DATE_FUNCDESC_DiffYears||
MONTHS|F5CeW|DATE_FUNCNAME_DiffMonths|Determines the number of months in a specific period.|FqH9T|DATE_FUNCDESC_DiffMonths||
WEEKS|pkA8s|DATE_FUNCNAME_DiffWeeks|Calculates the number of weeks in a specific period|c9Yb3|DATE_FUNCDESC_DiffWeeks||
FACTDOUBLE|CjDvf|ANALYSIS_FUNCNAME_Factdouble|Returns the double factorial of Number|6eGE3|ANALYSIS_Factdouble||
CONVERT|TNWeA|ANALYSIS_FUNCNAME_Convert|Converts a number from one measurement system to another|W5E64|ANALYSIS_Convert||
OCT2HEX|CRsqb|ANALYSIS_FUNCNAME_Oct2Hex|Converts an octal number to a hexadecimal number|Jrzq3|ANALYSIS_Oct2Hex||
OCT2DEC|BeZUW|ANALYSIS_FUNCNAME_Oct2Dec|Converts an octal number to a decimal number|z6LSc|ANALYSIS_Oct2Dec||
OCT2BIN|kjrZm|ANALYSIS_FUNCNAME_Oct2Bin|Converts an octal number to a binary number|GRuNw|ANALYSIS_Oct2Bin||
COMPLEX|mDhAE|ANALYSIS_FUNCNAME_Complex|Converts real and imaginary coefficients into a complex number|UFYAz|ANALYSIS_Complex||
IMCSCH|Gk9GH|ANALYSIS_FUNCNAME_Imcsch|Returns the hyperbolic cosecant of a complex number|AaL4p|ANALYSIS_Imcsch||
IMSECH|BZqDR|ANALYSIS_FUNCNAME_Imsech|Returns the hyperbolic secant of a complex number|E2PFF|ANALYSIS_Imsech||
IMCOSH|ErNKG|ANALYSIS_FUNCNAME_Imcosh|Returns the hyperbolic cosine of a complex number|cyJtB|ANALYSIS_Imcosh||
IMSINH|ZwUUB|ANALYSIS_FUNCNAME_Imsinh|Returns the hyperbolic sine of a complex number|myVrC|ANALYSIS_Imsinh||
IMCOT|k2mSC|ANALYSIS_FUNCNAME_Imcot|Returns the cotangent of a complex number|EyNFt|ANALYSIS_Imcot||
IMCSC|tFG7J|ANALYSIS_FUNCNAME_Imcsc|Returns the cosecant of a complex number|PrEHE|ANALYSIS_Imcsc||
IMSEC|p2cPB|ANALYSIS_FUNCNAME_Imsec|Returns the secant of a complex number|X6woF|ANALYSIS_Imsec||
IMTAN|kMNhg|ANALYSIS_FUNCNAME_Imtan|Returns the tangent of a complex number|YZ9Pk|ANALYSIS_Imtan||
IMSQRT|on4GJ|ANALYSIS_FUNCNAME_Imsqrt|Returns the square root of a complex number|xkwz7|ANALYSIS_Imsqrt||
IMSUM|5dggL|ANALYSIS_FUNCNAME_Imsum|Returns the sum of complex numbers|uSe75|ANALYSIS_Imsum||
IMSUB|WSpWr|ANALYSIS_FUNCNAME_Imsub|Returns the difference of two complex numbers|pCwcH|ANALYSIS_Imsub||
IMSIN|ChCKv|ANALYSIS_FUNCNAME_Imsin|Returns the sine of a complex number|QPDkx|ANALYSIS_Imsin||
IMREAL|XxrtP|ANALYSIS_FUNCNAME_Imreal|Returns the real coefficient of a complex number|rQyiX|ANALYSIS_Imreal||
IMPRODUCT|KcP8D|ANALYSIS_FUNCNAME_Improduct|Returns the product of several complex numbers|5VA5w|ANALYSIS_Improduct||
IMLOG2|GABGC|ANALYSIS_FUNCNAME_Imlog2|Returns the base-2 logarithm of a complex number|EXBBs|ANALYSIS_Imlog2||
IMLOG10|MNkNW|ANALYSIS_FUNCNAME_Imlog10|Returns the base-10 logarithm of a complex number|FUpg6|ANALYSIS_Imlog10||
IMLN|Sc6mT|ANALYSIS_FUNCNAME_Imln|Returns the natural logarithm of a complex number|nW87F|ANALYSIS_Imln||
IMCONJUGATE|iqoX7|ANALYSIS_FUNCNAME_Imconjugate|Returns the complex conjugate of a complex number|6NpYd|ANALYSIS_Imconjugate||
IMEXP|WAfnR|ANALYSIS_FUNCNAME_Imexp|Returns the algebraic form of the exponential of a complex number|bwWr4|ANALYSIS_Imexp||
IMDIV|RhiUy|ANALYSIS_FUNCNAME_Imdiv|Returns the quotient of two complex numbers|mSsaT|ANALYSIS_Imdiv||
IMCOS|QBnyT|ANALYSIS_FUNCNAME_Imcos|Returns the cosine of a complex number|9BMRu|ANALYSIS_Imcos||
IMARGUMENT|J8V8z|ANALYSIS_FUNCNAME_Imargument|Returns the argument theta, an angle expressed in radians|sgsXU|ANALYSIS_Imargument||
IMPOWER|GGQs6|ANALYSIS_FUNCNAME_Impower|Returns a complex number raised to a real power|66PGj|ANALYSIS_Impower||
IMAGINARY|QYDVB|ANALYSIS_FUNCNAME_Imaginary|Returns the imaginary coefficient of a complex number|dsEFU|ANALYSIS_Imaginary||
IMABS|FBn6B|ANALYSIS_FUNCNAME_Imabs|Returns the absolute value (modulus) of a complex number|Kv6Gh|ANALYSIS_Imabs||
HEX2OCT|jfDsA|ANALYSIS_FUNCNAME_Hex2Oct|Converts a hexadecimal number to an octal number|CGBvb|ANALYSIS_Hex2Oct||
HEX2DEC|kNsKk|ANALYSIS_FUNCNAME_Hex2Dec|Converts a hexadecimal number to a decimal number|GBDrZ|ANALYSIS_Hex2Dec||
HEX2BIN|B2YNX|ANALYSIS_FUNCNAME_Hex2Bin|Converts a hexadecimal number to a binary number|sC97t|ANALYSIS_Hex2Bin||
GESTEP|YAJQK|ANALYSIS_FUNCNAME_Gestep|Tests whether a number is greater than a threshold value|DBz3C|ANALYSIS_Gestep||
ERFC|7CPZS|ANALYSIS_FUNCNAME_Erfc|Returns the complementary error function|Wgmmu|ANALYSIS_Erfc||
ERF|WFFDC|ANALYSIS_FUNCNAME_Erf|Returns the error function|L672d|ANALYSIS_Erf||
DEC2OCT|dnxfS|ANALYSIS_FUNCNAME_Dec2Oct|Converts a decimal number into an octal number|JVcUH|ANALYSIS_Dec2Oct||
DEC2HEX|bpBJG|ANALYSIS_FUNCNAME_Dec2Hex|Converts a decimal number to a hexadecimal number|LDwCT|ANALYSIS_Dec2Hex||
DEC2BIN|AJC9F|ANALYSIS_FUNCNAME_Dec2Bin|Converts a decimal number to a binary number|gtNKg|ANALYSIS_Dec2Bin||
DELTA|PHzDg|ANALYSIS_FUNCNAME_Delta|Tests whether two values are equal|vXJmG|ANALYSIS_Delta||
BIN2OCT|3tbwu|ANALYSIS_FUNCNAME_Bin2Oct|Converts a binary number to an octal number|sYWZ4|ANALYSIS_Bin2Oct||
BIN2HEX|zrP9E|ANALYSIS_FUNCNAME_Bin2Hex|Converts a binary number to a hexadecimal number|WLAuB|ANALYSIS_Bin2Hex||
BIN2DEC|2C4PK|ANALYSIS_FUNCNAME_Bin2Dec|Converts a binary number to a decimal number|HMzjE|ANALYSIS_Bin2Dec||
BESSELY|NQCGW|ANALYSIS_FUNCNAME_Bessely|Returns the Bessel function Yn(x)|zxDiU|ANALYSIS_Bessely||
BESSELK|Frcpi|ANALYSIS_FUNCNAME_Besselk|Returns the Bessel function Kn(x)|KBFDb|ANALYSIS_Besselk||
BESSELJ|oyZnL|ANALYSIS_FUNCNAME_Besselj|Returns the Bessel function Jn(x)|aoFgN|ANALYSIS_Besselj||
BESSELI|EFSFy|ANALYSIS_FUNCNAME_Besseli|Returns the modified Bessel function In(x)|hQFoN|ANALYSIS_Besseli||
RANDBETWEEN|MM79F|ANALYSIS_FUNCNAME_Randbetween|Returns a random integer between the numbers you specify|mFwk5|ANALYSIS_Randbetween||
SQRTPI|pzJ2T|ANALYSIS_FUNCNAME_Sqrtpi|Returns the square root of a number which has been multiplied by pi|ECLDw|ANALYSIS_Sqrtpi||
MROUND|kkrhF|ANALYSIS_FUNCNAME_Mround|Returns a number rounded to a specified multiple|FXVBd|ANALYSIS_Mround||
QUOTIENT|MKPGe|ANALYSIS_FUNCNAME_Quotient|Returns the integer portion of a division|ksJ6q|ANALYSIS_Quotient||
SERIESSUM|e9f3r|ANALYSIS_FUNCNAME_Seriessum|Returns the sum of a power series|LYRJS|ANALYSIS_Seriessum||
MULTINOMIAL|Gw9iH|ANALYSIS_FUNCNAME_Multinomial|Returns the multinomial coefficient of a set of numbers|B3DFV|ANALYSIS_Multinomial||
LCM|xrRGD|ANALYSIS_FUNCNAME_Lcm|Returns the least common multiple|hZczM|ANALYSIS_Lcm||
GCD|yLkFC|ANALYSIS_FUNCNAME_Gcd|Returns the greatest common divisor|7pTXG|ANALYSIS_Gcd||
ISODD|PjGBW|ANALYSIS_FUNCNAME_Isodd|Returns the value 'true' if the number is odd|Eez7w|ANALYSIS_Isodd||
ISEVEN|8zjDt|ANALYSIS_FUNCNAME_Iseven|Returns the value 'true' if the number is even|euGgs|ANALYSIS_Iseven||
FVSCHEDULE|PAGij|ANALYSIS_FUNCNAME_Fvschedule|Returns the future value of the initial principal after a series of compound interest rates are applied|BkVLD|ANALYSIS_Fvschedule||
COUPNUM|PT2LT|ANALYSIS_FUNCNAME_Coupnum|Returns the number of coupons payable between the settlement and maturity dates|DyfXD|ANALYSIS_Coupnum||
COUPPCD|NxQyv|ANALYSIS_FUNCNAME_Couppcd|Returns the last coupon date preceding the settlement date|2iCqW|ANALYSIS_Couppcd||
COUPDAYBS|9BDGp|ANALYSIS_FUNCNAME_Coupdaybs|Returns the number of days from the beginning of the coupon period to the settlement date|KBBcx|ANALYSIS_Coupdaybs||
COUPDAYSNC|h9Uhw|ANALYSIS_FUNCNAME_Coupdaysnc|Returns the number of days from the settlement date to the next coupon date|FBGxa|ANALYSIS_Coupdaysnc||
COUPDAYS|gF8PM|ANALYSIS_FUNCNAME_Coupdays|Returns the number of days in the coupon period containing the settlement date|cYCWX|ANALYSIS_Coupdays||
COUPNCD|D8crD|ANALYSIS_FUNCNAME_Coupncd|Returns the first coupon date after the settlement date|ZkR4n|ANALYSIS_Coupncd||
INTRATE|8P3JL|ANALYSIS_FUNCNAME_Intrate|Returns the interest rate for a fully invested security|nBr2f|ANALYSIS_Intrate||
XNPV|hn3KX|ANALYSIS_FUNCNAME_Xnpv|Returns the net present value for a non-periodic schedule of payments|vGqGR|ANALYSIS_Xnpv||
XIRR|EKqrE|ANALYSIS_FUNCNAME_Xirr|Returns the internal rate of return for a non-periodic schedule of payments|85tPn|ANALYSIS_Xirr||
ODDLYIELD|bEdTF|ANALYSIS_FUNCNAME_Oddlyield|Returns the yield of a security with an odd last period|Pe9J2|ANALYSIS_Oddlyield||
ODDLPRICE|ZBn5D|ANALYSIS_FUNCNAME_Oddlprice|Returns the price per $100 face value of a security with an odd last period|6buPR|ANALYSIS_Oddlprice||
ODDFYIELD|5sKBo|ANALYSIS_FUNCNAME_Oddfyield|Returns the yield of a security with an odd first period|yHLCB|ANALYSIS_Oddfyield||
ODDFPRICE|Bv7hm|ANALYSIS_FUNCNAME_Oddfprice|Returns the price per $100 face value of a security with an odd first period|gSR5y|ANALYSIS_Oddfprice||
TBILLYIELD|CEeGV|ANALYSIS_FUNCNAME_Tbillyield|Returns the yield for a treasury bill|P4WjL|ANALYSIS_Tbillyield||
TBILLPRICE|sNGGb|ANALYSIS_FUNCNAME_Tbillprice|Returns the price of 100 currency units face value for a treasury bill|e8DVw|ANALYSIS_Tbillprice||
TBILLEQ|fRGcn|ANALYSIS_FUNCNAME_Tbilleq|Returns the bond-equivalent yield for a treasury bill|CmKjR|ANALYSIS_Tbilleq||
YIELDMAT|W5ij7|ANALYSIS_FUNCNAME_Yieldmat|Returns the annual yield of a security that pays interest at maturity|BfjuC|ANALYSIS_Yieldmat||
YIELDDISC|etCXF|ANALYSIS_FUNCNAME_Yielddisc|Returns the annual yield for a discounted security|iuQnm|ANALYSIS_Yielddisc||
YIELD|dMKqD|ANALYSIS_FUNCNAME_Yield|Returns the yield on a security that pays periodic interest|GT2fw|ANALYSIS_Yield||
DOLLARDE|b3c5F|ANALYSIS_FUNCNAME_Dollarde|Converts a price expressed as a fraction into a price expressed as a decimal|hdkeU|ANALYSIS_Dollarde||
DOLLARFR|tCGEv|ANALYSIS_FUNCNAME_Dollarfr|Converts a price expressed as a decimal into a price expressed as a fraction|ACBda|ANALYSIS_Dollarfr||
NOMINAL|dTciF|ANALYSIS_FUNCNAME_Nominal|Returns the annual nominal interest rate|Qfqzn|ANALYSIS_Nominal||
MDURATION|nENuF|ANALYSIS_FUNCNAME_Mduration|Returns the Macaulay modified duration for a security with an assumed par value of 100 currency units|XB3Cf|ANALYSIS_Mduration||
PRICEMAT|AkksF|ANALYSIS_FUNCNAME_Pricemat|Returns the price per 100 currency units face value of a security that pays interest at maturity|Nyx6J|ANALYSIS_Pricemat||
PRICEDISC|PSxKu|ANALYSIS_FUNCNAME_Pricedisc|Returns the price per 100 currency units face value of a discounted security|4cQCF|ANALYSIS_Pricedisc||
PRICE|TrN8j|ANALYSIS_FUNCNAME_Price|Returns the price per 100 currency units face value of a security that pays periodic interest|ZNXE3|ANALYSIS_Price||
CUMIPMT|giE2c|ANALYSIS_FUNCNAME_Cumipmt|Returns the cumulative interest to be paid between two periods|g4KQF|ANALYSIS_Cumipmt||
CUMPRINC|7AYEt|ANALYSIS_FUNCNAME_Cumprinc|Returns the cumulative principal on a loan to be paid between two periods|HrSEQ|ANALYSIS_Cumprinc||
EFFECT|zCxoq|ANALYSIS_FUNCNAME_Effect|Returns the effective annual interest rate|FMyAB|ANALYSIS_Effect||
DURATION|ET83v|ANALYSIS_FUNCNAME_Duration|Returns the annual Macaulay duration of a security with periodic interest payments|Y9aav|ANALYSIS_Duration||
DISC|6HHZX|ANALYSIS_FUNCNAME_Disc|Returns the discount rate for a security|SDipc|ANALYSIS_Disc||
RECEIVED|83LwA|ANALYSIS_FUNCNAME_Received|Returns the amount paid out at maturity for a fully invested security|QHBha|ANALYSIS_Received||
ACCRINTM|xGuEM|ANALYSIS_FUNCNAME_Accrintm|Returns the accrued interest for a security that pays interest at maturity|SPUpd|ANALYSIS_Accrintm||
ACCRINT|z9irP|ANALYSIS_FUNCNAME_Accrint|Returns the accrued interest for a security that pays periodic interest|z5FMG|ANALYSIS_Accrint||
AMORLINC|Vyaq3|ANALYSIS_FUNCNAME_Amorlinc|Returns the prorated linear depreciation of an asset for each accounting period|Tfg5i|ANALYSIS_Amorlinc||
AMORDEGRC|cqNFM|ANALYSIS_FUNCNAME_Amordegrc|Returns the prorated linear depreciation of an asset for each accounting period|AD7tA|ANALYSIS_Amordegrc||
NETWORKDAYS|2s2Ci|ANALYSIS_FUNCNAME_Networkdays|Returns the number of workdays between two dates|FFvBM|ANALYSIS_Networkdays||
EOMONTH|hGiQU|ANALYSIS_FUNCNAME_Eomonth|Returns the serial number of the last day of the month that comes a certain number of months before or after the start date|MEBN5|ANALYSIS_Eomonth||
WEEKNUM|fL5qd|ANALYSIS_FUNCNAME_Weeknum|Returns the number of the calendar week in which the specified date occurs.|KRJDB|ANALYSIS_Weeknum||
EDATE|RnTE8|ANALYSIS_FUNCNAME_Edate|Returns the serial number of the date that is a specified number of months before or after the start date|Au76P|ANALYSIS_Edate||
YEARFRAC|kGmgF|ANALYSIS_FUNCNAME_Yearfrac|Returns the number of years (including fractional part) between two dates|8bZCK|ANALYSIS_Yearfrac||
WORKDAY|rMBDp|ANALYSIS_FUNCNAME_Workday|Returns the serial number of the date before or after a specified number of workdays|vmpEf|ANALYSIS_Workday||
OPT_PROB_INMONEY|46dEf|PRICING_FUNCNAME_OptProbInMoney|Probability that an asset will at maturity end up between two barrier levels, assuming it follows dS/S = mu dt + vol dW (if the last two optional parameters (strike, put/call) are specified, the probability of S_T in [strike, upper barrier] for a call and S_T in [lower barrier, strike] for a put will be returned)|8GTWB|PRICING_FUNCDESC_OptProbInMoney||
OPT_PROB_HIT|RTkVk|PRICING_FUNCNAME_OptProbHit|Probability that an asset hits a barrier assuming it follows dS/S = mu dt + vol dW|HusZF|PRICING_FUNCDESC_OptProbHit||
OPT_TOUCH|Y3VTD|PRICING_FUNCNAME_OptTouch|Pricing of a touch/no-touch option|qGohA|PRICING_FUNCDESC_OptTouch||
OPT_BARRIER|aXoaK|PRICING_FUNCNAME_OptBarrier|Pricing of a barrier option|DCfi6|PRICING_FUNCDESC_OptBarrier||
